<?xml version="1.0" encoding="UTF-8"?>
<KSCRefreshSettings xsi:noNamespaceSchemaLocation="../../KSCRefreshSettings.xsd" xmlns:xsi="http://www.w3.org/2001/XMLSchema-instance">
	<Country Country="AT">
		<Settings>
			<General PollInterval="5000" LogLevel="Warnings" Test="false"/>
			<SMTP Port="25" Host="10.100.121.30" SendMailFrom="csc_phabor@phoenixgroup.eu">
				<Information eMail=""/>
				<Warnings eMail=""/>
				<Errors eMail="kscrefreshtest@phoenixgroup.eu;"/>
			</SMTP>
			<TCAccess IPAddress="10.242.5.212" TCATransaction="TCAS" TCAHost="PhoenixGeneric_west" ConnectionRetries="10" ConnectionWaitBeforeRetry="10000" Username="CORPHA" Password=""/>
			<pxVerbund DeviceType="7" DeviceName="PHATRA" Computer="" LogMode="1" DataSource="oat21@zdev21_shm" MessageFile="/software/wss/at/ksc/batch/ini/message.txt"/>
			<Informix ConnectionRetries="10" ConnectionWaitBeforeRetry="10000" IfxServiceName="53004" IfxHost="zdev21_tcp" IfxDataBase="oat21"/>
		</Settings>
		<Branches>
			<Branch BranchNo="62">
				<Settings>
					<TCAccess Port="3101"/>
					<pxVerbund LogFile="/software/wss/at/ksc/batch/log/cics01_csc_phabor.log" SystemLogFile="/software/wss/at/ksc/batch/log/cics01_csc_phabor_wws.log"/>
				</Settings>
			</Branch>
		</Branches>
	</Country>
</KSCRefreshSettings>
