<?xml version="1.0" encoding="UTF-8"?>
<KSCRefreshSettings xsi:noNamespaceSchemaLocation="KSCRefreshSettings.xsd" xmlns:xsi="http://www.w3.org/2001/XMLSchema-instance">
	<Country Country="HR">
		<Settings>
			<General PollInterval="5000" LogLevel="Warnings" Test="false" />			
			<SMTP Port="25" Host="10.100.121.30" SendMailFrom="kscrefresh@phoenixgroup.eu">
				<Information eMail="kscrefreshtest@phoenixgroup.eu" />
				<Warnings eMail="kscrefreshtest@phoenixgroup.eu" />
				<Errors eMail="kscrefreshtest@phoenixgroup.eu" />
			</SMTP>
			<TCAccess TCATransaction="TCAS" TCAHost="PhoenixGeneric_west" ConnectionRetries="10" ConnectionWaitBeforeRetry="10000" Username="PHADEX" Password="PHADEX" />
			<pxVerbund DeviceType="7" DeviceName="PHADEX" Computer="" LogMode="1" DataSource="ohr21@zdev21_shm" MessageFile="/software/wss/hr/ksc/batch/ini/message.txt" />
			<Informix ConnectionRetries="10" ConnectionWaitBeforeRetry="10000" IfxServiceName="53004" IfxHost="zdev21_tcp" IfxDataBase="ohr21" />	
		</Settings>
		<Branches>			
			<Branch BranchNo="71"><Settings><TCAccess IPAddress="10.242.5.211" Port="3100" /></Settings></Branch>
			<Branch BranchNo="72"><Settings><TCAccess IPAddress="10.242.5.211" Port="3100" /></Settings></Branch>
            <Branch BranchNo="73"><Settings><TCAccess IPAddress="10.242.5.211" Port="3100" /></Settings></Branch>
            <Branch BranchNo="74"><Settings><TCAccess IPAddress="10.242.5.211" Port="3100" /></Settings></Branch>
            <Branch BranchNo="77"><Settings><TCAccess IPAddress="10.242.5.211" Port="3100" /></Settings></Branch>
		</Branches>		
	</Country>
</KSCRefreshSettings>
