<?xml version="1.0" encoding="UTF-8"?>
<KSCRefreshSettings xsi:noNamespaceSchemaLocation="../../KSCRefreshSettings.xsd" xmlns:xsi="http://www.w3.org/2001/XMLSchema-instance">
	<Country Country="CH">
		<Settings>
			<General PollInterval="5" LogLevel="Warnings" Test="false"/>
			<SMTP Port="25" Host="10.100.121.30" SendMailFrom="csc_phatra@phoenixgroup.eu">
				<Information eMail=""/>
				<Warnings eMail=""/>
				<Errors eMail="kscrefreshtest@phoenixgroup.eu"/>
			</SMTP>
			<TCAccess TCATransaction="TCAS" TCAHost="PhoenixGeneric_west" ConnectionRetries="10" ConnectionWaitBeforeRetry="10000" Username="PHATRA" Password=""/>
			<pxVerbund DeviceType="7" DeviceName="PHATRA" Computer="" LogMode="1" DataSource="och21pre@zdev21_shm" MessageFile="/software/wss/pch/ksc/batch/ini/message.txt"/>
			<Informix ConnectionRetries="10" ConnectionWaitBeforeRetry="10000" IfxServiceName="53004" IfxHost="zdev21_tcp" IfxDataBase="och21pre"/>
		</Settings>
		<Branches>			
			<Branch BranchNo="99">
				<Settings>
					<pxVerbund></pxVerbund>
				</Settings>
			</Branch>
		</Branches>
	</Country>
</KSCRefreshSettings>
