<?xml version="1.0" encoding="UTF-8"?>
<KSCRefreshSettings xsi:noNamespaceSchemaLocation="../../KSCRefreshSettings.xsd" xmlns:xsi="http://www.w3.org/2001/XMLSchema-instance">
	<Country Country="BG">
		<Settings>
			<General PollInterval="5" LogLevel="Warnings" Test="false"/>
			<SMTP Port="25" Host="10.100.121.30" SendMailFrom="kscrefresh@phoenixgroup.eu">
				<Information eMail=""/>
				<Warnings eMail=""/>
				<Errors eMail="kscrefreshtest@phoenixgroup.eu"/>
			</SMTP>
			<TCAccess TCATransaction="TCAS" TCAHost="PhoenixGeneric_cyr" ConnectionRetries="10" ConnectionWaitBeforeRetry="10000" Username="CORPHA" Password="CORPHA"/>
			<pxVerbund DeviceType="7" DeviceName="PHATRA" Computer="" LogMode="1" DataSource="obg21@zdev21_shm" MessageFile="/software/wss/bg/ksc/batch/ini/message.txt"/>
			<Informix ConnectionRetries="10" ConnectionWaitBeforeRetry="10000" IfxServiceName="53004" IfxHost="zdev21_tcp" IfxDataBase="obg21"/>
		</Settings>
		<Branches>
			<Branch BranchNo="28">
				<Settings>
					<TCAccess IPAddress="10.242.5.211" Port="3101"/>
					<pxVerbund LogFile="/software/wss/bg/ksc/batch/log/28_csc_phatra.log" SystemLogFile="/software/wss/bg/ksc/batch/log/28_csc_phatra_wws.log"/>
				</Settings>
			</Branch>
			<Branch BranchNo="23">
				<Settings>
					<TCAccess IPAddress="10.242.5.211" Port="3102"/>
					<pxVerbund LogFile="/software/wss/bg/ksc/batch/log/23_csc_phatra.log" SystemLogFile="/software/wss/bg/ksc/batch/log/23_csc_phatra_wws.log"/>
				</Settings>
			</Branch>
			<Branch BranchNo="22">
				<Settings>
					<TCAccess IPAddress="10.242.5.211" Port="3106"/>
					<pxVerbund LogFile="/software/wss/bg/ksc/batch/log/22_csc_phatra.log" SystemLogFile="/software/wss/bg/ksc/batch/log/22_csc_phatra_wws.log"/>
				</Settings>
			</Branch>
		</Branches>
	</Country>
</KSCRefreshSettings>
