<?xml version="1.0" encoding="UTF-8"?>
<KSCRefreshSettings xsi:noNamespaceSchemaLocation="../../KSCRefreshSettings.xsd" xmlns:xsi="http://www.w3.org/2001/XMLSchema-instance">
	<Country Country="DE">
		<Settings>
			<General PollInterval="30" LogLevel="Warnings" Test="false"/>
			<SMTP Port="25" Host="10.100.121.30" SendMailFrom="csc_phatra@phoenixgroup.eu">
				<Information eMail=""/>
				<Warnings eMail=""/>
				<Errors eMail=""/>
			</SMTP>
			<TCAccess TCATransaction="TCAS" TCAHost="PhoenixGeneric_west" ConnectionRetries="10" ConnectionWaitBeforeRetry="10000" Username="PHATRA" Password=""/>
			<pxVerbund DeviceType="7" DeviceName="PHATRA" Computer="" LogMode="1" DataSource="ode21@zdev21_shm" MessageFile="/software/wss/de/ksc/batch/ini/message.txt"/>
			<Informix ConnectionRetries="10" ConnectionWaitBeforeRetry="10000" IfxServiceName="53004" IfxHost="zdev21_tcp" IfxDataBase="ode21"/>
		</Settings>
		<Branches>
			<Branch BranchNo="0">
				<Settings>
					<General PollInterval="15" Test="true"/>
					<TCAccess Activate="false"/>
					<ZDP ConnectionRetries="10" ConnectionWaitBeforeRetry="10000" IfxServiceName="53004" IfxHost="zdev21_tcp" IfxDataBase="ide21"/>
					<pxVerbund LogFile="/software/wss/de/ksc/batch/log/0_csc_phatra.log" SystemLogFile="/software/wss/de/ksc/batch/log/0_csc_phatra_wws.log"/>
				</Settings>
			</Branch>
			<Branch BranchNo="46">
				<Settings>
					<TCAccess IPAddress="10.242.5.210" Port="3102"/>
					<pxVerbund LogFile="/software/wss/de/ksc/batch/log/46_csc_phatra.log" SystemLogFile="/software/wss/de/ksc/batch/log/46_csc_phatra_wws.log"/>
				</Settings>
			</Branch>
			<Branch BranchNo="59">
				<Settings>
					<TCAccess IPAddress="10.242.5.210" Port="3103" Activate="false"/>
					<ZDP IfxHost="zdev21_tcp" IfxDataBase="ide21"/>
					<pxVerbund LogFile="/software/wss/de/ksc/batch/log/59_csc_phatra.log" SystemLogFile="/software/wss/de/ksc/batch/log/59_csc_phatra_wws.log"/>
				</Settings>
			</Branch>
		</Branches>
	</Country>
</KSCRefreshSettings>
